{
  "raw_round_id": "raw-round-1",
  "normalizer_version": "normalizer-v2",
  "facet_catalogue_version": "facet-catalogue-v1",
  "normalized_round": {
    "user_messages": ["The user mentioned PG while comparing PostgreSQL and SQLite."],
    "source_event_index": {
      "event-1": "The user mentioned PG while comparing PostgreSQL and SQLite.",
      "event-2": "The user selected LedgerMind Local for this repository.",
      "event-3": "The database system is called Database Engine and its alias is DB.",
      "event-4": "The editor is Visual Studio Code, also called VS Code."
    },
    "context_references": ["retrieval-1", "value-1"]
  },
  "mentions": [
    {
      "mention_ref": "m-existing",
      "surface_text": "PG",
      "normalized_text": "pg",
      "source_event_id": "event-1",
      "span_start": 0,
      "span_end": 2,
      "candidate_set_digest": "sha256:0000000000000000000000000000000000000000000000000000000000000000",
      "candidates": [
        {
          "object_id": "obj-postgresql",
          "canonical_name": "PostgreSQL",
          "aliases": ["PG", "Postgres"],
          "match_reasons": ["exact_alias", "repository_match"],
          "rank": 1,
          "lexical_score": 1.0,
          "embedding_score": 0.94,
          "context_score": 0.82,
          "final_score": 0.95,
          "project_match": true,
          "repository_match": true,
          "task_match": false,
          "related_object_match": false,
          "conversation_match": true,
          "explicit_scope_mismatch": false
        },
        {
          "object_id": "obj-sqlite",
          "canonical_name": "SQLite",
          "aliases": ["SQLite"],
          "match_reasons": ["repository_match"],
          "rank": 2,
          "lexical_score": 0.6,
          "embedding_score": 0.55,
          "context_score": 0.9,
          "final_score": 0.7,
          "project_match": true,
          "repository_match": true,
          "task_match": false,
          "related_object_match": false,
          "conversation_match": false,
          "explicit_scope_mismatch": false
        },
        {
          "object_id": "obj-mysql",
          "canonical_name": "MySQL",
          "aliases": ["MySql"],
          "match_reasons": [],
          "rank": 3,
          "lexical_score": 0.5,
          "embedding_score": 0.48,
          "context_score": 0.3,
          "final_score": 0.4,
          "project_match": false,
          "repository_match": false,
          "task_match": false,
          "related_object_match": false,
          "conversation_match": false,
          "explicit_scope_mismatch": false
        },
        {
          "object_id": "obj-mariadb",
          "canonical_name": "MariaDB",
          "aliases": [],
          "match_reasons": [],
          "rank": 4,
          "lexical_score": 0.4,
          "embedding_score": 0.45,
          "context_score": 0.2,
          "final_score": 0.32,
          "project_match": false,
          "repository_match": false,
          "task_match": false,
          "related_object_match": false,
          "conversation_match": false,
          "explicit_scope_mismatch": false
        },
        {
          "object_id": "obj-postgres-fork",
          "canonical_name": "Postgres Fork",
          "aliases": ["postgres fork"],
          "match_reasons": ["lexical_similarity"],
          "rank": 5,
          "lexical_score": 0.3,
          "embedding_score": 0.4,
          "context_score": 0.1,
          "final_score": 0.25,
          "project_match": false,
          "repository_match": false,
          "task_match": false,
          "related_object_match": false,
          "conversation_match": false,
          "explicit_scope_mismatch": false
        },
        {
          "object_id": "obj-mongodb",
          "canonical_name": "MongoDB",
          "aliases": ["mongo"],
          "match_reasons": [],
          "rank": 6,
          "lexical_score": 0.2,
          "embedding_score": 0.5,
          "context_score": 0.1,
          "final_score": 0.2,
          "project_match": false,
          "repository_match": false,
          "task_match": false,
          "related_object_match": false,
          "conversation_match": false,
          "explicit_scope_mismatch": false
        },
        {
          "object_id": "obj-redis",
          "canonical_name": "Redis",
          "aliases": [],
          "match_reasons": [],
          "rank": 7,
          "lexical_score": 0.1,
          "embedding_score": 0.42,
          "context_score": 0.05,
          "final_score": 0.12,
          "project_match": false,
          "repository_match": false,
          "task_match": false,
          "related_object_match": false,
          "conversation_match": false,
          "explicit_scope_mismatch": false
        },
        {
          "object_id": "obj-scope-mismatch",
          "canonical_name": "PostgreSQL Other Repository",
          "aliases": [],
          "match_reasons": ["lexical_similarity"],
          "rank": 8,
          "lexical_score": 0.1,
          "embedding_score": 0.4,
          "context_score": 0.05,
          "final_score": 0.1,
          "project_match": false,
          "repository_match": false,
          "task_match": false,
          "related_object_match": false,
          "conversation_match": false,
          "explicit_scope_mismatch": true
        }
      ]
    },
    {
      "mention_ref": "m-new",
      "surface_text": "LedgerMind Local",
      "normalized_text": "ledgermind local",
      "source_event_id": "event-2",
      "span_start": 0,
      "span_end": 16,
      "candidate_set_digest": "sha256:1111111111111111111111111111111111111111111111111111111111111111",
      "candidates": []
    },
    {
      "mention_ref": "m-ambiguous",
      "surface_text": "Database",
      "normalized_text": "database",
      "source_event_id": "event-3",
      "span_start": 0,
      "span_end": 8,
      "candidate_set_digest": "sha256:2222222222222222222222222222222222222222222222222222222222222222",
      "candidates": [
        {
          "object_id": "obj-database-a",
          "canonical_name": "Database Engine",
          "aliases": ["DB"],
          "match_reasons": ["lexical_similarity"],
          "rank": 1,
          "lexical_score": 0.8,
          "embedding_score": 0.7,
          "context_score": 0.4,
          "final_score": 0.7,
          "project_match": false,
          "repository_match": true,
          "task_match": false,
          "related_object_match": false,
          "conversation_match": false,
          "explicit_scope_mismatch": false
        },
        {
          "object_id": "obj-database-b",
          "canonical_name": "Database Service",
          "aliases": ["DB"],
          "match_reasons": ["lexical_similarity"],
          "rank": 2,
          "lexical_score": 0.75,
          "embedding_score": 0.72,
          "context_score": 0.3,
          "final_score": 0.68,
          "project_match": false,
          "repository_match": true,
          "task_match": false,
          "related_object_match": false,
          "conversation_match": false,
          "explicit_scope_mismatch": false
        }
      ]
    },
    {
      "mention_ref": "m-extended",
      "surface_text": "Visual Studio Code",
      "normalized_text": "visual studio code",
      "source_event_id": "event-4",
      "span_start": 0,
      "span_end": 18,
      "candidate_set_digest": "sha256:3333333333333333333333333333333333333333333333333333333333333333",
      "candidates": []
    }
  ],
  "resolution_context": {
    "project_id": "project-ledgermind",
    "repository_id": "repo-core",
    "task_id": "task-1",
    "conversation_id": "conversation-1",
    "related_object_ids": ["obj-ledgermind"]
  }
}
